Unnamed: 0,name,answer
0,配送员,"作为物流行业的职业分析师，我将为您提供关于配送员的专业素养、通用能力和专业技能的分析。请注意，以下提供的信息仅为关键词和术语，不包含描述性语句。
专业素养：
道德责任能力：诚信，责任心，正直，敬业，谦逊，尊重他人，公正，保密，诚实，忠诚
安全环保能力：安全意识，紧急应对，防范意识，环境保护，事故处理，应急预案，风险评估，安全规范，操作规程，危险识别
沟通合作能力：团队合作，有效沟通，倾听技巧，冲突管理，文化敏感，协作精神，灵活性，互助，共享信息，协调能力
创业能力：主动性，创新思维，问题解决，决策能力，自我驱动，市场洞察，商业意识，资源整合，风险管理，目标导向
通用能力：
学习能力：持续学习，自主学习，快速学习，知识获取，信息搜索，学习适应，学习方法，知识整理，学习反馈，学习动力
信息能力：信息分析，信息处理，信息检索，数据管理，信息评估，信息整合，信息筛选，信息传递，信息安全，信息更新
沟通能力：口头表达，书面表达，演讲技巧，情绪管理，非语言沟通，逻辑思维，跨文化沟通，反馈接受，清晰表达，沟通技巧
解决问题能力：问题识别，分析思考，创造性解决，决策能力，逻辑思维，解决方案评估，问题求助，问题复现，解决技巧，问题沟通
专业技能：
快递操作能力：包裹装箱，货物分拣，装卸技巧，快递标识，货物存储，配送路线规划，订单处理，收寄管理，派件操作，签收确认
路况判断能力：导航使用，地图阅读，交通规则，路况评估，道路选择，交通事故处理，交通信号，交通标识，驾驶技巧，路线熟悉
技术设备操作能力：
技术设备操作能力：扫码枪使用，电子签收系统，GPS追踪，智能手持终端，电子支付，无人机操作，安全设备操作，电子监控，车载导航，通信设备操作
客户服务能力：问题解答，客户需求分析，投诉处理，客户关系管理，客户满意度评估，服务态度，电话礼仪，客户咨询，投递时间协商，投递提醒
库存管理能力：入库验收，库存记录，库存调配，货物盘点，库存清理，货物装载，库存盈亏分析，库存报告，库存补充，仓储设备操作
驾驶技能：安全驾驶，平稳驾驶，驾驶规范，紧急情况应对，货物保护，交通法规，驾驶记录，货物稳固，驾驶安全设备使用，反应灵敏
应急处理能力：意外事故处理，配送延误应对，突发情况处理，道路封闭应对，客户需求变更应对，货物损坏处理，天气突变应对，交通堵塞应对，迷路处理，紧急送件
技术故障排除能力：设备故障排查，网络问题解决，设备重启，软件故障排除，设备维护，故障日志分析，设备校准，故障诊断，硬件更换，用户指导
危险品处理能力：危险品辨识，危险品包装，危险品运输规定，危险品报告，危险品事故处置，危险品标识，应急预案，危险品存储，危险品运输工具检查，危险品装载技巧
时间管理能力：配送路线规划，派送时间安排，时间分配，工作日程安排，时间效率，任务优先级，工作节奏，时间预估，及时派送，时间规划"
1,物流专员,"作为物流行业的职业分析师，我将为您提供关于物流专员的专业素养、通用能力和专业技能的分析。请注意，以下提供的信息仅为关键词和术语，不包含描述性语句。
专业素养：
道德责任能力：诚信，责任心，正直，敬业，谦逊，尊重他人，公正，保密，诚实，忠诚
安全环保能力：安全意识，紧急应对，防范意识，环境保护，事故处理，应急预案，风险评估，安全规范，操作规程，危险识别
沟通合作能力：团队合作，有效沟通，倾听技巧，冲突管理，文化敏感，协作精神，灵活性，互助，共享信息，协调能力
创业能力：主动性，创新思维，问题解决，决策能力，自我驱动，市场洞察，商业意识，资源整合，风险管理，目标导向
通用能力：
学习能力：持续学习，自主学习，快速学习，知识获取，信息搜索，学习适应，学习方法，知识整理，学习反馈，学习动力
信息能力：信息分析，信息处理，信息检索，数据管理，信息评估，信息整合，信息筛选，信息传递，信息安全，信息更新
沟通能力：口头表达，书面表达，演讲技巧，情绪管理，非语言沟通，逻辑思维，跨文化沟通，反馈接受，清晰表达，沟通技巧
解决问题能力：问题识别，分析思考，创造性解决，决策能力，逻辑思维，解决方案评估，问题求助，问题复现，解决技巧，问题沟通
专业技能：
订单处理能力：订单管理，订单跟踪，订单分配，订单确认，订单查询，订单配送，订单优化，订单系统操作，订单调度，订单处理
运输管理能力：货物包装，货物装卸，货物运输，运输路线规划，货物跟踪，运输安排，运输协调，运输成本控制，货物配送，运输方式选择
仓储操作能力：仓储管理，货物存储，库存管理，仓库布局，仓库
仓储操作能力：仓储管理，货物存储，库存管理，仓库布局，仓库清洁，货物装载，仓储安全，货物盘点，仓库设备操作，仓库标识
物流信息管理能力：物流数据分析，物流信息系统操作，物流跟踪，物流信息查询，物流信息报告，物流信息安全，物流信息更新，信息共享，信息反馈，信息整理
供应链协调能力：供应商协调，供应链流程管理，供应链风险评估，供应链合作，供应链优化，供应链沟通，供应链协调，供应链协作，供应链决策，供应链可见性
运输协调能力：运输计划安排，运输资源调配，运输成本控制，运输安全管理，运输服务协商，运输协调，运输效率优化，运输异常处理，运输信息交流，运输报告编制
运营支持能力：业务流程管理，运营数据分析，运营报告编制，运营绩效评估，运营方案制定，运营支持系统操作，运营成本控制，运营问题解决，运营优化，运营目标设定
质量控制能力：质量检验，质量标准制定，质量监控，异常品处理，质量问题解决，质量改进，质量评估，质量报告编制，质量意识培养，质量管理体系
客户服务能力：客户需求分析，投诉处理，客户关系管理，客户满意度评估，服务态度，电话礼仪，客户咨询，投递协调，投递提醒，客户沟通
紧急处理能力：突发情况处理，运输事故应对，紧急配送，应急预案，运输延误应对，危机管理，紧急情况协调，紧急问题解决，紧急反应，紧急救援
以上是针对物流专员的专业素养、通用能力和专业技能的分析，希望对您有所帮助。"
2,物流主管,"作为物流行业的职业分析师，我将为您提供关于物流主管的专业素养、通用能力和专业技能的分析。请注意，以下提供的信息仅为关键词和术语，不包含描述性语句。
专业素养：
道德责任能力：诚信，责任心，正直，敬业，谦逊，尊重他人，公正，保密，诚实，忠诚
安全环保能力：安全意识，紧急应对，防范意识，环境保护，事故处理，应急预案，风险评估，安全规范，操作规程，危险识别
沟通合作能力：团队合作，有效沟通，倾听技巧，冲突管理，文化敏感，协作精神，灵活性，互助，共享信息，协调能力
创业能力：主动性，创新思维，问题解决，决策能力，自我驱动，市场洞察，商业意识，资源整合，风险管理，目标导向
通用能力：
学习能力：持续学习，自主学习，快速学习，知识获取，信息搜索，学习适应，学习方法，知识整理，学习反馈，学习动力
信息能力：信息分析，信息处理，信息检索，数据管理，信息评估，信息整合，信息筛选，信息传递，信息安全，信息更新
沟通能力：口头表达，书面表达，演讲技巧，情绪管理，非语言沟通，逻辑思维，跨文化沟通，反馈接受，清晰表达，沟通技巧
解决问题能力：问题识别，分析思考，创造性解决，决策能力，逻辑思维，解决方案评估，问题求助，问题复现，解决技巧，问题沟通
专业技能：
运营管理能力：运营策略制定，流程优化，运营规划，绩效管理，资源调配，风险控制，变革管理，供应链管理，项目管理，绩效评估
团队管理能力：团队建设，团队协调，目标设定，绩效评估，人员培养，冲突解决，激励激发，团队沟通，团队合作，人员调配
成本控制
成本控制能力：成本分析，成本优化，成本预算，成本管理，成本效益分析，成本降低，成本控制策略，成本核算，成本节约，成本监控
供应链优化能力：供应链分析，供应链协调，供应链合作，供应链改进，供应链效率，供应链风险管理，供应链网络优化，供应链协同，供应链可见性，供应链决策
质量管理能力：质量标准制定，质量控制，质量改进，质量检查，质量评估，质量问题解决，质量意识培养，质量监控，质量报告编制，质量体系管理
运输协调能力：运输计划安排，运输资源调配，运输成本控制，运输安全管理，运输服务协商，运输协调，运输效率优化，运输异常处理，运输信息交流，运输报告编制
仓储管理能力：仓库布局，货物存储，库存管理，仓储流程优化，仓库操作，仓库安全管理，仓库设备操作，仓库盘点，仓库系统管理，仓库调度
项目管理能力：项目规划，项目执行，项目控制，项目进度管理，项目资源管理，项目风险管理，项目团队协调，项目变更管理，项目评估，项目报告编制
客户关系管理能力：客户需求分析，客户满意度评估，客户反馈处理，客户关系建立，客户沟通协调，客户投诉处理，客户合作管理，客户信息管理，客户信任建立，客户关怀
数据分析能力：数据收集，数据清洗，数据分析，数据可视化，数据解读，数据挖掘，数据报告编制，数据驱动决策，数据质量管理，数据模型建立
以上是针对物流主管的专业素养、通用能力和专业技能的分析，希望对您有所帮助。"
3,物流项目专员,"作为物流行业的职业分析师，我将为您提供关于物流项目专员的专业素养、通用能力和专业技能的分析。请注意，以下提供的信息仅为关键词和术语，不包含描述性语句。
专业素养：
道德责任能力：诚信、责任心、正直、敬业、谦逊、尊重他人、公正、保密、诚实、忠诚
安全环保能力：安全意识、紧急应对、防范意识、环境保护、事故处理、应急预案、风险评估、安全规范、操作规程、危险识别
沟通合作能力：团队合作、有效沟通、倾听技巧、冲突管理、文化敏感、协作精神、灵活性、互助、共享信息、协调能力
创业能力：主动性、创新思维、问题解决、决策能力、自我驱动、市场洞察、商业意识、资源整合、风险管理、目标导向
通用能力：
学习能力：持续学习、自主学习、快速学习、知识获取、信息搜索、学习适应、学习方法、知识整理、学习反馈、学习动力
信息能力：信息分析、信息处理、信息检索、数据管理、信息评估、信息整合、信息筛选、信息传递、信息安全、信息更新
沟通能力：口头表达、书面表达、演讲技巧、情绪管理、非语言沟通、逻辑思维、跨文化沟通、反馈接受、清晰表达、沟通技巧
解决问题能力：问题识别、分析思考、创造性解决、决策能力、逻辑思维、解决方案评估、问题求助、问题复现、解决技巧、问题沟通
专业技能：
项目规划能力：需求分析、目标设定、资源调配、时间管理、项目风险评估、项目进度控制、项目执行监督、项目团队协作、项目报告编制、问题解决能力
供应链管理能力：供应商选择、物料采购、库存管理、物流运输协调、供应链协同优化、供应链风险评估、供应链效率提升、供应链信息管理、质量管理、成本控制
数据
数据分析能力：数据收集，数据清洗，数据分析，数据可视化，数据解读，数据挖掘，数据报告编制，数据驱动决策，数据质量管理，数据模型建立
物流计划能力：运输计划制定，物流网络设计，货物分配，运输路线规划，运输资源调度，运输成本分析，运输效率优化，货物跟踪，配送策略，仓储规划
供应商管理能力：供应商评估，供应商合作协调，供应商绩效监控，供应商风险评估，合同管理，供应商关系建立，供应商选择，供应商谈判，供应商审计，供应商合规性
仓储管理能力：仓库布局设计，货物存储管理，库存控制，仓储流程优化，仓库设备操作，仓储安全管理，库存盘点，仓库操作系统，订单处理，仓储成本控制
运输协调能力：运输计划安排，运输资源调配，运输成本控制，运输安全管理，运输服务协商，运输协调，运输效率优化，运输异常处理，运输信息交流，运输报告编制
质量管理能力：质量标准制定，质量控制，质量改进，质量检查，质量评估，质量问题解决，质量意识培养，质量监控，质量报告编制，质量体系管理
成本控制能力：成本分析，成本优化，成本预算，成本管理，成本效益分析，成本降低，成本控制策略，成本核算，成本节约，成本监控
项目管理能力：项目规划，项目执行，项目控制，项目进度管理，项目资源管理，项目风险管理，项目团队协调，项目变更管理，项目评估，项目报告编制
以上是针对物流项目专员的专业素养、通用能力和专业技能的分析，希望对您有所帮助。"
4,物流经理,"作为物流行业的职业分析师，我将为您提供关于物流经理的专业素养、通用能力和专业技能的分析。请注意，以下提供的信息仅为关键词和术语，不包含描述性语句。
专业素养：
道德责任能力：诚信，责任心，正直，敬业，谦逊，尊重他人，公正，保密，诚实，忠诚
安全环保能力：安全意识，紧急应对，防范意识，环境保护，事故处理，应急预案，风险评估，安全规范，操作规程，危险识别
沟通合作能力：团队合作，有效沟通，倾听技巧，冲突管理，文化敏感，协作精神，灵活性，互助，共享信息，协调能力
创业能力：主动性，创新思维，问题解决，决策能力，自我驱动，市场洞察，商业意识，资源整合，风险管理，目标导向
通用能力：
学习能力：持续学习，自主学习，快速学习，知识获取，信息搜索，学习适应，学习方法，知识整理，学习反馈，学习动力
信息能力：信息分析，信息处理，信息检索，数据管理，信息评估，信息整合，信息筛选，信息传递，信息安全，信息更新
沟通能力：口头表达，书面表达，演讲技巧，情绪管理，非语言沟通，逻辑思维，跨文化沟通，反馈接受，清晰表达，沟通技巧
解决问题能力：问题识别，分析思考，创造性解决，决策能力，逻辑思维，解决方案评估，问题求助，问题复现，解决技巧，问题沟通
专业技能：
供应链管理能力：供应商选择，物料采购，库存管理，物流运输协调，供应链协同优化，供应链风险评估，供应链效率提升，供应链信息管理，质量管理，成本控制
项目管理能力：项目规划，项目执行，项目控制，项目进度管理，项目资源管理，项目风险管理，项目团队协调，项目变更管理，项目评估，项目报告编制
财务管理能力：预算管理
财务管理能力：预算管理，成本控制，财务报表分析，财务规划，资金管理，财务风险评估，投资决策，财务指标分析，利润管理，财务合规性
供应商管理能力：供应商评估，供应商合作协调，供应商绩效监控，供应商风险评估，合同管理，供应商关系建立，供应商选择，供应商谈判，供应商审计，供应商合规性
运输管理能力：运输计划安排，运输资源调配，运输成本控制，运输安全管理，运输服务协商，运输协调，运输效率优化，运输异常处理，运输信息交流，运输报告编制
仓储管理能力：仓库布局设计，货物存储管理，库存控制，仓储流程优化，仓库设备操作，仓储安全管理，库存盘点，仓库操作系统，订单处理，仓储成本控制
质量管理能力：质量标准制定，质量控制，质量改进，质量检查，质量评估，质量问题解决，质量意识培养，质量监控，质量报告编制，质量体系管理
市场分析能力：市场调研，竞争分析，需求预测，市场定位，市场趋势分析，市场营销策略，品牌管理，市场推广，客户满意度调查，市场报告撰写
团队管理能力：团队建设，目标设定，任务分配，团队激励，冲突管理，绩效评估，沟通协作，团队培训，团队合作精神，领导能力
10.技术应用能力：物流信息系统应用，数据分析工具使用，运输管理软件操作，仓储管理系统应用，财务管理软件使用，项目管理工具应用，供应链管理软件操作，市场分析工具使用，团队协作工具应用，技术趋势了解
以上是针对物流经理的专业素养、通用能力和专业技能的分析，希望对您有所帮助。"
5,货代专员,"好的，针对货代专员，我将从专业素养、通用能力和专业技能三个维度进行分析，提取并列出重要能力和相应的技能关键词。请注意，每个能力名称不超过8个中文字符，每个技能关键词使用中文顿号隔开，且每个关键词长度在4-6个中文字符之间。
专业素养：
道德责任能力：诚信守信，职业操守，道德准则，社会责任，合规意识，职业道德，责任心，尊重他人，公平正义，自我约束
安全环保能力：安全意识，风险评估，安全操作，环保意识，事故预防，紧急处理，危险品管理，安全培训，安全规范，环境保护
沟通合作能力：沟通技巧，团队合作，信息共享，合作协调，人际关系，问题解决，灵活应变，跨部门协作，客户关系，合作精神
创业能力：创新思维，机会把握，商业意识，决策能力，市场洞察，风险管理，目标导向，资源整合，问题解决，持续改进
通用能力：
5. 通用能力：学习能力，适应能力，创造力，问题解决，分析思考，决策能力，时间管理，自我管理，团队协作，自我反思
信息能力：信息收集，信息分析，信息管理，数据处理，报告撰写，文件管理，信息安全，电子邮件，办公软件，信息共享
专业技能：
7. 运输管理能力：运输安排，运输跟踪，运输协调，运输文件处理，运输费用核算，货物装卸，货物包装，运输保险，运输合规性，运输报告编制
报关报检能力：进出口报关，报检手续，单证操作，关税政策，报关规范，报关查询，报关核销，报关监管，报检检验，报关报检系统
文件操作能力：文件整理，文件归档，文件传递，文件审查，文件扫描，文件复印，文件记录，文件备份，文件检索，文件保密
客户服务能力：客户咨询，订单处理，投诉处理，问题解决，客户满意度调查，客户关系维护，客户需求分析，客户反
馈，客户投诉处理，客户沟通，客户合作
以上是针对货代专员在专业素养、通用能力和专业技能三个维度的重要能力和对应的技能关键词。希望对你的分析任务有所帮助！"
6,货代经理,"好的，针对货代经理，我将从专业素养、通用能力和专业技能三个维度进行分析，提取并列出重要能力和相应的技能关键词。请注意，每个能力名称不超过8个中文字符，每个技能关键词使用中文顿号隔开，且每个关键词长度在4-6个中文字符之间。
专业素养：
道德责任能力：诚信守信，职业操守，道德准则，社会责任，合规意识，职业道德，责任心，尊重他人，公平正义，自我约束
安全环保能力：安全意识，风险评估，安全操作，环保意识，事故预防，紧急处理，危险品管理，安全培训，安全规范，环境保护
沟通合作能力：沟通技巧，团队合作，信息共享，合作协调，人际关系，问题解决，灵活应变，跨部门协作，客户关系，合作精神
创业能力：创新思维，机会把握，商业意识，决策能力，市场洞察，风险管理，目标导向，资源整合，问题解决，持续改进
通用能力：
5. 通用能力：学习能力，适应能力，创造力，问题解决，分析思考，决策能力，时间管理，自我管理，团队协作，自我反思
信息能力：信息收集，信息分析，信息管理，数据处理，报告撰写，文件管理，信息安全，电子邮件，办公软件，信息共享
专业技能：
7. 运输管理能力：运输安排，运输跟踪，运输协调，运输文件处理，运输费用核算，货物装卸，货物包装，运输保险，运输合规性，运输报告编制
报关报检能力：进出口报关，报检手续，单证操作，关税政策，报关规范，报关查询，报关核销，报关监管，报检检验，报关报检系统
文件操作能力：文件整理，文件归档，文件传递，文件审查，文件扫描，文件复印，文件记录，文件备份，文件检索，文件保密
客户服务能力：客户咨询，订单处理，投诉处理，问题解决，客户满意度调查，客户关系维护，客户需求分析，客户反
馈，市场分析，销售技巧
以上是针对货代经理在专业素养、通用能力和专业技能三个维度的重要能力和对应的技能关键词。希望对你的分析任务有所帮助！"
