Unnamed: 0,name,answer
30,外贸主管,"以下是针对外贸主管的能力分析：
专业素养：
道德责任能力：职业操守、诚信意识、合规意识、职业道德、责任心
安全环保能力：质量控制、安全管理、环境保护、风险评估、可持续发展
沟通合作能力：团队协作、跨文化沟通、合作意识、合作伙伴关系、协商能力
创业能力：市场洞察、商业计划、创新思维、风险管理、机会把握
人员管理能力：团队管理、员工培训、绩效评估、激励机制、冲突解决
业务拓展能力：市场调研、客户开发、合作伙伴拓展、市场推广、业务增长
领导能力：目标设定、决策能力、人员指导、资源分配、问题解决
策略规划能力：业务规划、市场战略、竞争分析、风险评估、业务优化
质量管理能力：质量控制、过程改进、标准制定、质量评估、质量监控
组织协调能力：项目管理、资源调配、任务分配、进度控制、团队协作
通用能力：
学习能力：持续学习、知识更新、信息获取、学习方法、行业趋势
解决问题能力：问题分析、解决方案、决策能力、逻辑思维、创造性思维
信息能力：市场研究、数据分析、信息收集、报告撰写、信息管理
时间管理能力：任务分配、优先级管理、工作效率、时间规划、紧急情况应对
跨部门协调能力：部门沟通、合作协调、冲突管理、团队合作、问题解决
领导力：目标设定、团队管理、决策能力、激励机制、变革管理
人际关系能力：沟通技巧、人际协调、合作精神、团队建设、冲突管理
决策能力：风险评估、问题分析、决策制定、结果评估、紧急情况处理
项目管理能力：项目
项目管理能力：项目计划、资源调配、进度控制、风险管理、问题解决
人际沟通能力：交流技巧、表达能力、倾听能力、情绪管理、跨文化沟通
专业技能：
外贸业务能力：国际贸易、进出口操作、报关报检、国际支付、贸易术语
销售技巧能力：客户开发、谈判技巧、合同管理、客户关系、销售策略
市场分析能力：市场调研、竞争分析、需求预测、市场定位、市场策略
合同管理能力：合同起草、合同审核、合同执行、风险控制、合同谈判
报价与议价能力：产品定价、报价策略、议价技巧、成本分析、价格谈判
物流运输能力：运输管理、货物跟踪、仓储管理、运输安排、运输协调
贸易法规能力：国际贸易法律、贸易合规、海关法规、贸易制裁、知识产权保护
外文文书能力：商务英语、文件翻译、合同起草、商务函电、外文资料阅读
支付结算能力：国际支付方式、信用证操作、付款申请、结算核对、支付风险
跨文化管理能力：文化理解、文化适应、文化差异管理、跨文化沟通、国际商务礼仪
以上是针对外贸主管的专业素养、通用能力和专业技能的能力分析，希望能对你的工作有所帮助。"
31,外贸经理,"专业素养：
道德责任能力：职业道德、合规意识、诚信经营、道德决策、社会责任
安全环保能力：安全管理、环境保护、危险品管理、安全风险评估、应急响应
沟通合作能力：团队合作、跨部门沟通、合作协调、问题解决、人际关系
创业能力：创新思维、机会把握、决策能力、资源整合、市场拓展
风险管理能力：风险识别、风险评估、风险控制、危机应对、风险决策
组织协调能力：资源调配、项目管理、工作协调、绩效管理、目标达成
信息管理能力：信息收集、数据分析、信息筛选、信息处理、信息应用
跨文化管理能力：文化理解、文化适应、文化差异管理、跨文化沟通、国际商务礼仪
决策能力：分析决策、战略决策、风险决策、问题解决、创新决策
时间管理能力：任务分配、工作计划、时间优化、优先级管理、工作效率
通用能力：
学习能力：学习意识、学习方法、知识应用、学习效果、持续学习
信息能力：信息收集、信息分析、信息处理、信息应用、信息更新
逻辑思维能力：问题分析、思维严谨、逻辑推理、创新思维、问题解决
沟通能力：口头表达、书面表达、倾听能力、非语言沟通、信息传递
团队合作能力：团队意识、协作能力、团队沟通、冲突管理、团队目标
创新能力：创造力、想象力、创新思维、解决问题、改进能力
解决问题能力：问题分析、解决方案、决策能力、创新解决、协调能力
管理能力：组织管理、人员管理、资源管理、决策管理、协调管理
自我管理能力：时间管理、压力管理、目标管理、自我激励、个人发展
10.领导能力：影响力、决策能力、指导能
导能力、激励能力、团队管理
专业技能：
外贸业务能力：订单处理、报关操作、国际贸易术语、国际运输、贸易合同
贸易条款分析能力：价格条款、付款条款、装运条款、保险条款、索赔处理
市场调研能力：市场分析、竞争分析、产品定位、需求预测、市场推广
供应链管理能力：供应商管理、物流协调、库存管理、采购计划、供应链优化
跨境电商能力：跨境平台运营、商品上架、订单处理、物流跟踪、客户服务
国际商务谈判能力：谈判策略、沟通技巧、利益协调、合同谈判、关系维护
财务分析能力：财务报表分析、成本控制、利润预测、资金管理、投资分析
贸易法律法规能力：国际贸易法律、合同法律、海关法规、知识产权、争议解决
外汇管理能力：汇率风险管理、外汇结算、外汇交易、外汇政策、外汇风险预测
10.国际物流能力：运输方式选择、货物包装、报关操作、仓储管理、物流成本控制"
32,关务经理,"作为物流行业的职业分析师，我将根据你的要求对关务经理的专业素养、通用能力和专业技能进行分析。下面是每个维度的重要能力和相应的技能关键词：
专业素养：
道德责任能力：守信承诺、诚信合规、道德决策、职业操守、道德意识、道德规范、诚实守信、道德准则、责任感、行业道德。
安全环保能力：风险管理、危险识别、环境保护、安全意识、安全法规、事故预防、安全标准、危险控制、环境影响评估、安全监督。
沟通合作能力：团队合作、跨部门沟通、有效沟通、合作协调、人际关系、表达能力、协作能力、沟通技巧、冲突管理、问题解决。
通用能力：
学习能力：持续学习、自主学习、学习方法、知识获取、学习适应、学习动力、学习态度、学习策略、学习能力评估、知识更新。
信息能力：信息收集、信息筛选、信息分析、信息处理、信息传递、信息安全、信息管理、信息检索、信息评估、信息应用。
解决问题能力：问题分析、解决方案、创新思维、决策能力、问题识别、问题解决能力、分析能力、综合能力、解决复杂问题、危机处理。
专业技能：
进出口操作能力：报关操作、进口手续、出口手续、报关单证、海关申报、进出口流程、报关规定、海关监管、报关业务、口岸操作。
贸易条款解读能力：贸易合同、条款分析、合同风险、国际贸易、贸易政策、条款评估、合同解释、贸易法规、合同起草、合同执行。
海关政策熟悉能力：关税规定、进出口政策、海关监管、优惠政策、关税减免、退税政策、报关政策、贸易政策、贸易协定、海关法规。
物流运输管理能力：运输组织、运输方案、货物追踪、物流成本、运输合同、仓储
物流运输管理能力（续）：货物配送、运输安排、运输监控、运输优化、运输风险、运输技术、运输流程、货物保险、运输协调、运输效率。
报关文件编制能力：报关单填写、商业发票、装箱单、运输单据、报检申请、报关申请、货物清单、报关资料、报关要素、单证审核。
国际贸易法律法规了解能力：国际贸易法、贸易争端解决、合规法规、贸易合同法、海关法规、国际贸易协定、进出口规定、国际贸易条例、反倾销法、知识产权保护法。
跨文化沟通能力：文化意识、语言能力、跨文化交流、国际礼仪、文化适应性、文化差异、跨文化认知、文化敏感性、文化冲突解决、跨文化合作。
供应链管理能力：供应链规划、供应链优化、供应链协调、供应商管理、库存管理、需求预测、物流网络设计、运输选择、成本控制、供应链信息系统。
质量管理能力：质量标准、质量控制、质量监督、质量改进、质量评估、质量认证、不良品处理、质量管理体系、质量意识、质量统计。
10.风险管理能力：风险评估、风险控制、风险分析、风险预警、风险应对、风险管理体系、风险规避、风险决策、风险监测、供应链风险。
以上是关务经理在专业素养、通用能力和专业技能三个维度上的重要能力和对应的技能关键词。"
33,核销员,"作为物流行业的职业分析师，我将根据你的要求对核销员的专业素养、通用能力和专业技能进行分析。下面是每个维度的重要能力和相应的技能关键词：
专业素养：
道德责任能力：诚信守约、道德准则、职业操守、责任感、道德决策、诚实守信、道德规范、道德意识、道德约束、道德教育。
安全环保能力：安全意识、风险管理、安全规范、环境保护、安全操作、危险识别、安全标准、安全风险评估、安全监督、安全法规。
沟通合作能力：团队合作、协作能力、跨部门沟通、有效沟通、协商能力、沟通技巧、合作协调、人际关系、冲突管理、问题解决。
通用能力：
学习能力：自主学习、持续学习、学习方法、知识获取、学习态度、学习动力、学习适应、学习策略、学习能力评估、知识更新。
信息能力：信息收集、信息筛选、信息分析、信息处理、信息传递、信息安全、信息管理、信息检索、信息评估、信息应用。
解决问题能力：问题分析、解决方案、创新思维、决策能力、问题识别、问题解决能力、分析能力、综合能力、解决复杂问题、危机处理。
专业技能：
核销凭证处理能力：核销操作、凭证审核、凭证记录、核销准确性、凭证调整、凭证编号、凭证解释、凭证流程、核销程序、核销管理。
财务报表分析能力：财务数据分析、报表解读、财务指标分析、财务比率分析、财务报表评估、财务风险分析、财务数据提取、财务报表处理、财务报表准备、财务报告分析。
收支核对能力：收支记录、款项核对、账目核对、费用核对、支出审计、收入核对、资金核对、核对凭证、支出凭证、收入凭证。
付款审核能力：付款申请、付款审批、付款流程、付款凭证、付款记录、付款控制、供应商
付款审核能力（续）：付款条件、付款方式、供应商管理、款项核对、财务控制、付款准确性、付款调整、供应商付款、付款程序、付款管理。
数据录入准确性能力：数据输入、数据校对、数据核实、数据整理、数据准确性、数据验证、数据更新、数据管理、数据记录、数据处理。
结算管理能力：结算流程、结算方式、账务处理、应收应付、费用结算、结算调整、结算凭证、结算管理、结算程序、结算系统。
账务处理能力：账目管理、账务调整、账务凭证、账务记录、账务核对、账务报告、账务流程、账务审计、账务准确性、账务系统。
业务协调能力：业务合作、业务协调、业务沟通、业务流程、业务需求、业务支持、业务数据、业务解决、业务分析、业务改进。
报表编制能力：报表准备、报表格式、报表分析、报表调整、报表内容、报表填写、报表管理、报表审查、报表统计、报表解释。
10.财务制度遵循能力：财务规范、财务流程、财务政策、财务程序、财务要求、财务法规、财务准则、财务条款、财务合规、财务制度。
以上是核销员在专业素养、通用能力和专业技能三个维度上的重要能力和对应的技能关键词。"
34,安检员,"作为物流行业的职业分析师，我将根据你的要求对安检员的专业素养、通用能力和专业技能进行分析。下面是每个维度的重要能力和相应的技能关键词：
专业素养：
道德责任能力：诚信守约、道德准则、职业操守、责任感、道德决策、诚实守信、道德规范、道德意识、道德约束、道德教育。
安全环保能力：安全意识、风险管理、安全规范、环境保护、安全操作、危险识别、安全标准、安全风险评估、安全监督、安全法规。
沟通合作能力：团队合作、协作能力、跨部门沟通、有效沟通、协商能力、沟通技巧、合作协调、人际关系、冲突管理、问题解决。
通用能力：
学习能力：自主学习、持续学习、学习方法、知识获取、学习态度、学习动力、学习适应、学习策略、学习能力评估、知识更新。
信息能力：信息收集、信息筛选、信息分析、信息处理、信息传递、信息安全、信息管理、信息检索、信息评估、信息应用。
解决问题能力：问题分析、解决方案、创新思维、决策能力、问题识别、问题解决能力、分析能力、综合能力、解决复杂问题、危机处理。
专业技能：
安全检查能力：安检程序、危险品识别、安全设备操作、安全检查技术、安全检查流程、安全检查要求、安全隐患排查、安全检查记录、安全检查报告、安全防范措施。
X光机操作能力：X光机原理、X光机调试、X光机检测、X光机图像分析、X光机故障排除、X光机维护、X光机安全操作、X光机报警处理、X光机参数调整、X光机扫描技术。
手工检查能力：手工检查程序、物品辨识、手工搜索、手工排查、手工检验、手工筛查、手工翻包、手工摸底、手工取样、手工识别。
安检仪器维
安检仪器维护能力：设备维护、故障排除、设备保养、设备校准、设备检修、维护记录、设备安装、设备调试、设备保养、设备保修。
安全规章执行能力：安全标准、规章制度、安全流程、安全操作、安全指导、安全培训、安全监管、安全合规、安全整改、安全管理。
紧急情况应对能力：应急处置、危险判断、紧急撤离、紧急救援、紧急通知、紧急报警、危机应对、紧急应急、紧急情况管理、应急预案。
安全风险评估能力：风险识别、风险评估、风险控制、风险分析、风险预防、安全评估、风险报告、风险管理、安全控制、安全防范。
身份验证能力：身份识别、证件检查、身份核实、身份确认、身份比对、身份记录、身份验证、身份识别技术、身份识别方法、身份审查。
素材检查能力：行李检查、包裹检查、物品检查、材料检查、货物检查、包裹筛查、行李筛查、物品筛查、材料筛查、货物筛查。
报告撰写能力：检查报告、安全报告、事故报告、异常报告、风险报告、报告编制、报告分析、报告撰写、报告评估、报告整理。
以上是安检员在专业素养、通用能力和专业技能三个维度上的重要能力和对应的技能关键词。"
35,集装箱管理员,"作为物流行业的职业分析师，我将根据你的要求对集装箱管理员的专业素养、通用能力和专业技能进行分析。下面是每个维度的重要能力和相应的技能关键词：
专业素养：
道德责任能力：诚信守约、道德准则、职业操守、责任感、道德决策、诚实守信、道德规范、道德意识、道德约束、道德教育。
安全环保能力：安全意识、风险管理、安全规范、环境保护、安全操作、危险识别、安全标准、安全风险评估、安全监督、安全法规。
沟通合作能力：团队合作、协作能力、跨部门沟通、有效沟通、协商能力、沟通技巧、合作协调、人际关系、冲突管理、问题解决。
通用能力：
学习能力：自主学习、持续学习、学习方法、知识获取、学习态度、学习动力、学习适应、学习策略、学习能力评估、知识更新。
信息能力：信息收集、信息筛选、信息分析、信息处理、信息传递、信息安全、信息管理、信息检索、信息评估、信息应用。
解决问题能力：问题分析、解决方案、创新思维、决策能力、问题识别、问题解决能力、分析能力、综合能力、解决复杂问题、危机处理。
专业技能：
集装箱操作能力：装箱操作、卸箱操作、堆场操作、装卸流程、集装箱搬运、装卸设备、货物摆放、装卸安全、装卸工具、集装箱管理。
进出口流程管理能力：报关流程、报检流程、运输协议、进出口手续、货物跟踪、货物保险、文件管理、进出口操作、进出口法规、进出口条款。
库存管理能力：库存监控、库存盘点、库存调配、库存记录、库存优化、库存安全、库存报告、库存分析、库存控制、库存运营。
装箱计划能力：装箱布局、装箱设计、装箱方案、装箱要求、货物分类、装箱操作、装箱调度、装箱安全、装箱流程、装箱标准。
货物追踪能力：货物跟踪系统、货物查询、运输状态、货物定位、货物追踪技术、货物追踪工具、运输监控、运输跟踪、货物跟踪记录、运输信息。
6. 装卸设备操作能力：起重机操作、叉车操作、吊车操作、装卸设备维护、装卸设备检查、装卸设备安全、装卸设备调试、装卸设备操作规程、装卸设备故障排除、装卸设备保养。
集装箱管理能力：集装箱配载、集装箱定位、集装箱堆放、集装箱维护、集装箱检查、集装箱安全、集装箱追踪、集装箱调度、集装箱装卸、集装箱库存。
运输协调能力：运输安排、运输调度、运输计划、运输需求、运输资源、运输协商、运输合作、运输监控、运输协调技巧、运输成本控制。
问题解决能力：运输异常处理、物流纠纷解决、货损处理、客诉处理、运输瓶颈解决、供应链问题解决、危机应对、问题排查、问题分析、问题解决技巧。
文档管理能力：文件归档、文件整理、文件存档、文件备份、文件传递、文件管理系统、文档审核、文档记录、文档检索、文件分类。
以上是集装箱管理员在专业素养、通用能力和专业技能三个维度上的重要能力和对应的技能关键词。"
36,供应商管理,"作为物流行业的职业分析师，我将根据你的要求对供应商管理的专业素养、通用能力和专业技能进行分析。下面是每个维度的重要能力和相应的技能关键词：
专业素养：
道德责任能力：诚信守约、道德准则、职业操守、责任感、道德决策、诚实守信、道德规范、道德意识、道德约束、道德教育。
安全环保能力：安全意识、风险管理、安全规范、环境保护、安全操作、危险识别、安全标准、安全风险评估、安全监督、安全法规。
沟通合作能力：团队合作、协作能力、跨部门沟通、有效沟通、协商能力、沟通技巧、合作协调、人际关系、冲突管理、问题解决。
通用能力：
学习能力：自主学习、持续学习、学习方法、知识获取、学习态度、学习动力、学习适应、学习策略、学习能力评估、知识更新。
信息能力：信息收集、信息筛选、信息分析、信息处理、信息传递、信息安全、信息管理、信息检索、信息评估、信息应用。
解决问题能力：问题分析、解决方案、创新思维、决策能力、问题识别、问题解决能力、分析能力、综合能力、解决复杂问题、危机处理。
专业技能：
供应商评估能力：供应商审核、供应商合规、供应商选择、供应商风险评估、供应商绩效评估、供应商关系管理、供应商协议、供应商调查、供应商数据分析、供应商持续改进。
供应链协调能力：供应链管理、供应链优化、供应链协调、供应链协作、供应链合作、供应链关系、供应链流程、供应链沟通、供应链协议、供应链监控。
采购谈判能力：采购谈判策略、谈判技巧、供应商谈判、合同谈判、价格谈判、条款谈判、采购协议、谈判沟通、谈判目标、谈判方案。
供应链风险
供应链风险管理能力：风险评估、风险预警、供应链风险分析、风险应对、风险控制、供应商风险管理、供应链安全、风险管理工具、风险决策、风险监测。
合同管理能力：合同起草、合同审查、合同执行、合同管理系统、合同谈判、合同变更、合同评估、合同条款、合同风险、合同文件管理。
供应商协调能力：供应商合作、供应商协作、供应商关系管理、供应商沟通、供应商合作协议、供应商合作模式、供应商配合、供应商合作评估、供应商协调沟通、供应商冲突解决。
供应链成本控制能力：成本分析、成本优化、成本管理、成本控制方法、成本核算、成本节约、供应链成本评估、成本效益、成本可行性分析、成本降低策略。
质量管理能力：质量标准、质量控制、质量检查、供应商质量管理、质量评估、质量问题解决、质量监督、质量改进、质量保证、质量认证。
物流协调能力：物流规划、物流协调、物流管理、物流流程、物流配送、物流优化、物流调度、物流效率、物流运作、物流跟踪。
数据分析能力：数据收集、数据分析工具、数据处理、数据解读、数据挖掘、数据可视化、数据报告、数据统计、数据模型、数据趋势分析。
以上是供应商管理在专业素养、通用能力和专业技能三个维度上的重要能力和对应的技能关键词。"
