name,answer
财税大数据应用,"作为物流行业的职业分析师，我将为您提供关于财税大数据应用的专业素养、通用能力和专业技能的分析。下面是按照您的要求提取的三个维度的能力列表：
专业素养能力：
经济学原理：宏观经济学，微观经济学，经济周期，供求关系，成本分析
财务知识：财务报表分析，成本控制，财务指标，现金流量管理，会计原则
税法理解：税收政策，税务规划，税收合规，税务申报，税务审计
数据分析：统计学，数据挖掘，数据可视化，数据解读，数据建模
商业智能：数据驱动决策，预测分析，业务优化，风险管理，市场竞争分析
通用能力：
逻辑思维能力：问题解决，推理能力，分析思考，逻辑推理，概念抽象
沟通能力：口头表达，书面沟通，团队合作，跨部门协作，客户关系管理
创新思维：创意发散，问题发现，解决方案创造，改进提升，技术应用创新
项目管理：项目规划，任务分配，时间管理，风险控制，项目评估
综合分析能力：综合素材分析，综合判断，综合决策，综合评估，综合解决问题
专业技能：
数据处理：数据清洗，数据整合，数据导入导出，数据编程，数据验证
数据建模：统计建模，机器学习，时间序列分析，回归分析，聚类分析
数据可视化：可视化工具，图表设计，数据故事讲述，信息图表达，交互式可视化
数据查询：SQL查询，数据库管理，数据抽取，数据转换，数据查询优化
数据安全：数据隐私，数据保护，数据备份，访问控制，风险识别与防范
以上是针对财税大数据应用的专业素养、通用能力和专业技能的分析，希望能对您的文本分析任务有所帮助。"
资产评估与管理,"作为物流行业的职业分析师，我将为您提供关于资产评估与管理的专业素养、通用能力和专业技能的分析。下面是按照您的要求提取的三个维度的能力列表：
专业素养能力：
资产评估理论：资产定价模型，现金流量折现，市场价值分析，收益率计算，资产估值方法
金融知识：投资组合管理，资产配置，资本市场理论，风险管理，投资风险评估
财务分析：财务报表分析，财务指标评估，资产负债表分析，利润表分析，现金流量表分析
法律法规：资产管理法规，知识产权保护，合同管理，合规审计，风险防范
商业智能：数据分析，数据挖掘，决策支持，市场调研，竞争分析
通用能力：
问题解决能力：逻辑思维，创新思维，解决方案提供，决策能力，问题排查
沟通能力：口头表达，书面沟通，跨部门协作，客户关系管理，演示技巧
数据分析能力：数据处理，数据解读，数据可视化，统计分析，数据模型构建
项目管理：项目规划，进度管理，风险管理，团队协作，项目评估
综合分析能力：综合素材分析，综合判断，综合决策，综合评估，问题诊断
专业技能：
资产估值技能：现金流量估算，折现率计算，市场对比法，收益法，成本法
风险评估技能：风险识别，风险定量分析，风险管理策略，风险监控，风险评估工具
数据建模：统计建模，回归分析，时间序列分析，数据挖掘，机器学习
资产管理系统：资产登记与分类，资产处置，资产追踪，资产保养，资产报废
报告撰写：评估报告，风险分析报告，资产管理报告，决策支持报告，项目进展报告
以上是针对资产评估与管理的专业素养、通用能力和专业技能的分析，希望能对您的文本分析任务有所帮助。"
政府采购管理,"作为物流行业的职业分析师，我将为您提供关于政府采购管理的专业素养、通用能力和专业技能的分析。下面是按照您的要求提取的三个维度的能力列表：
专业素养能力：
政府采购法规：采购法律法规，采购政策，合同管理，采购监督，风险防范
采购流程：采购需求分析，招标文件编制，评标和定标，合同签订，履约管理
供应商管理：供应商筛选，供应商评估，供应商合作，供应商绩效管理，供应链管理
成本控制：预算编制，采购成本分析，成本效益评估，价格谈判，成本节约
项目管理：项目规划，进度管理，风险管理，团队协作，项目评估
通用能力：
问题解决能力：逻辑思维，创新思维，解决方案提供，决策能力，问题排查
沟通能力：口头表达，书面沟通，跨部门协作，客户关系管理，演示技巧
数据分析能力：数据处理，数据解读，数据可视化，统计分析，数据模型构建
项目管理：项目规划，进度管理，风险管理，团队协作，项目评估
综合分析能力：综合素材分析，综合判断，综合决策，综合评估，问题诊断
专业技能：
采购需求分析：需求调研，需求定义，需求分析方法，需求规格书，用户访谈
招标文件编制：招标策略，招标文件撰写，技术规格书，评分标准，招标文件审批
评标和定标：评标委员会组织，评标标准制定，评标方法，评标报告，定标结果
合同管理：合同起草，合同审批，合同履约监督，合同变更管理，合同索赔
采购风险管理：风险识别，风险评估，风险控制策略，风险应对措施，风险监控
以上是针对政府采购管理的专业素养、通用能力和专业技能的分析，希望能对您的文本分析任务有所帮助。"
保险实务,"作为物流行业的职业分析师，我将为您提供关于保险实务的专业素养、通用能力和专业技能的分析。下面是按照您的要求提取的三个维度的能力列表：
专业素养能力：
保险法规：保险法律法规，保险监管政策，保险合同法，保险理赔规定，风险防范
保险产品知识：险种分类，保险条款解读，保费计算，保额评估，产品创新
保险风险评估：风险识别，风险定量分析，风险管理策略，风险监控，风险评估工具
保险理赔流程：理赔申请，理赔资料审核，理赔决定，理赔支付，理赔案件处理
商业智能：数据分析，数据挖掘，决策支持，市场调研，竞争分析
通用能力：
问题解决能力：逻辑思维，创新思维，解决方案提供，决策能力，问题排查
沟通能力：口头表达，书面沟通，跨部门协作，客户关系管理，演示技巧
数据分析能力：数据处理，数据解读，数据可视化，统计分析，数据模型构建
项目管理：项目规划，进度管理，风险管理，团队协作，项目评估
综合分析能力：综合素材分析，综合判断，综合决策，综合评估，问题诊断
专业技能：
保险产品销售：销售技巧，需求分析，产品介绍，客户关系管理，保险销售策略
保险风险评估：风险识别，风险分析，风险评估工具，风险控制策略，风险管理
理赔管理：理赔流程掌握，理赔资料审核，理赔决策，理赔案件处理，索赔谈判
保险合同管理：合同起草，合同审批，合同履约监督，合同变更管理，合同索赔
保险风险管理：风险评估，风险控制策略，风险防范，风险监控，风险规避
以上是针对保险实务的专业素养、通用能力和专业技能的分析，希望能对您的文本分析任务有所帮助。"
信用管理,"作为物流行业的职业分析师，我将为您提供关于信用管理的专业素养、通用能力和专业技能的分析。下面是按照您的要求提取的三个维度的能力列表：
专业素养能力：
信用管理理论：信用评估模型，信用风险管理，信用政策，信用合规，信用修复
法律法规：信用法律法规，合同管理，法律合规，风险防范，法律风险评估
信用政策制定：信用标准制定，信用评价体系，信用奖惩机制，信用监控，信用政策调整
信用数据分析：信用数据收集，信用数据清洗，信用数据建模，信用数据解读，信用报告分析
商业智能：数据分析，数据挖掘，决策支持，市场调研，竞争分析
通用能力：
问题解决能力：逻辑思维，创新思维，解决方案提供，决策能力，问题排查
沟通能力：口头表达，书面沟通，跨部门协作，客户关系管理，演示技巧
数据分析能力：数据处理，数据解读，数据可视化，统计分析，数据模型构建
项目管理：项目规划，进度管理，风险管理，团队协作，项目评估
综合分析能力：综合素材分析，综合判断，综合决策，综合评估，问题诊断
专业技能：
信用评估技能：信用报告分析，信用评分模型，信用指标分析，信用评估工具，风险评估
风险控制技能：风险识别，风险分析，风险控制策略，风险防范，风险监控
信用修复技能：信用纠纷处理，信用修复方案，信用恢复计划，信用修复策略，信用纠错
数据分析工具：数据挖掘软件，数据可视化工具，统计分析软件，数据处理软件，数据建模工具
统计学知识：概率统计，假设检验，回归分析，时间序列分析，抽样理论
以上是针对信用管理的专业素养、通用能力和专业技能的分析，希望能对您的文本分析任务有所帮助。"
财富管理,"作为物流行业的职业分析师，我将为您提供关于财富管理的专业素养、通用能力和专业技能的分析。下面是按照您的要求提取的三个维度的能力列表：
专业素养能力：
财富管理理论：财富规划，投资理论，资产配置，财富保护，财富传承
理财知识：金融市场，投资产品，风险管理，投资组合，财务规划
税务筹划：税收政策，避税策略，税务合规，财务报表分析，税务审计
风险管理：风险识别，风险评估，风险控制，风险防范，风险投资
商业智能：数据分析，数据挖掘，决策支持，市场调研，竞争分析
通用能力：
问题解决能力：逻辑思维，创新思维，解决方案提供，决策能力，问题排查
沟通能力：口头表达，书面沟通，跨部门协作，客户关系管理，演示技巧
数据分析能力：数据处理，数据解读，数据可视化，统计分析，数据模型构建
项目管理：项目规划，进度管理，风险管理，团队协作，项目评估
综合分析能力：综合素材分析，综合判断，综合决策，综合评估，问题诊断
专业技能：
财务规划：财务目标设定，预算编制，资产分析，负债管理，投资计划
投资分析：行业分析，公司估值，投资风险评估，投资策略，投资决策
资产配置技能：资产分散化，资产组合构建，资产配置策略，资产风险控制，资产收益优化
税务筹划技能：个人所得税优化，财产转移策略，遗产规划，国际税务筹划，税收合规
财富传承技能：遗嘱编制，信托管理，家族办公室，慈善规划，资产继承
以上是针对财富管理的专业素养、通用能力和专业技能的分析，希望能对您的文本分析任务有所帮助。"
证券实务,"作为物流行业的职业分析师，我将为您提供关于证券实务的专业素养、通用能力和专业技能的分析。下面是按照您的要求提取的三个维度的能力列表：
专业素养能力：
证券市场知识：证券法规，证券交易所规则，证券市场机制，证券产品，证券交易流程
投资理论：资本市场理论，投资风险管理，投资组合理论，价值投资，技术分析
资金管理：资金规划，资金流动分析，风险控制，资金调度，资金筹集
法律法规：证券法规，合同管理，法律合规，风险防范，法律风险评估
商业智能：数据分析，数据挖掘，决策支持，市场调研，竞争分析
通用能力：
问题解决能力：逻辑思维，创新思维，解决方案提供，决策能力，问题排查
沟通能力：口头表达，书面沟通，跨部门协作，客户关系管理，演示技巧
数据分析能力：数据处理，数据解读，数据可视化，统计分析，数据模型构建
项目管理：项目规划，进度管理，风险管理，团队协作，项目评估
综合分析能力：综合素材分析，综合判断，综合决策，综合评估，问题诊断
专业技能：
证券投资分析：公司分析，行业分析，投资决策，估值方法，风险评估
交易执行技能：交易流程掌握，交易系统使用，交易指令执行，交易结果分析，交易错误处理
投资组合管理：资产配置，投资组合构建，风险控制，投资策略，绩效评估
风险管理：风险识别，风险评估，风险控制策略，风险防范，风险投资
报告撰写：投资报告，市场分析报告，风险评估报告，投资策略报告，绩效报告
以上是针对证券实务的专业素养、通用能力和专业技能的分析，希望能对您的文本分析任务有所帮助。"
农村金融,"作为物流行业的职业分析师，我将为您提供关于农村金融的专业素养、通用能力和专业技能的分析。下面是按照您的要求提取的三个维度的能力列表：
专业素养能力：
农村金融政策：农村金融法规，农村金融政策，农村信用体系建设，农村金融改革，农村金融创新
农村金融产品：农村信贷产品，农村保险产品，农村理财产品，农村支付产品，农村投资产品
农村金融市场：农村金融机构，农村金融市场发展，农村金融机制，农村金融监管，农村金融风险管理
农村金融知识：农村经济发展，农业经济学，农村金融管理，农村金融机遇与挑战，农村金融市场调查
商业智能：数据分析，数据挖掘，决策支持，市场调研，竞争分析
通用能力：
问题解决能力：逻辑思维，创新思维，解决方案提供，决策能力，问题排查
沟通能力：口头表达，书面沟通，跨部门协作，客户关系管理，演示技巧
数据分析能力：数据处理，数据解读，数据可视化，统计分析，数据模型构建
项目管理：项目规划，进度管理，风险管理，团队协作，项目评估
综合分析能力：综合素材分析，综合判断，综合决策，综合评估，问题诊断
专业技能：
农村信贷评估：借款人评估，抵押评估，贷款风险评估，信用评估，还款能力分析
农村金融风险管理：风险识别，风险评估，风险控制策略，风险防范，风险投资
农村金融产品设计：产品定位，产品规划，产品创新，产品市场调研，产品推广
农村金融市场调研：市场需求分析，竞争对手分析，市场定位，市场前景预测，市场营销策略
农村金融机构管理：机构设置，组织架构，人员管理，绩效考核，机构运营管理
以上是针对农村金融的专业素养、通用能力和专业技能的分析，希望能对您的文本分析任务有所帮助。"
大数据与审计,"作为物流行业的职业分析师，我将为您提供关于大数据与审计的专业素养、通用能力和专业技能的分析。下面是按照您的要求提取的三个维度的能力列表：
专业素养能力：
大数据技术：大数据分析，数据挖掘，数据可视化，数据处理，数据建模
审计法规：审计准则，审计程序，内部控制，合规性审计，风险管理
数据隐私与安全：数据保护法规，数据安全措施，隐私保护，数据加密，数据备份与恢复
数据分析工具：大数据平台，数据分析软件，数据可视化工具，统计分析工具，数据挖掘工具
商业智能：数据分析，数据挖掘，决策支持，市场调研，竞争分析
通用能力：
问题解决能力：逻辑思维，创新思维，解决方案提供，决策能力，问题排查
沟通能力：口头表达，书面沟通，跨部门协作，客户关系管理，演示技巧
数据分析能力：数据处理，数据解读，数据可视化，统计分析，数据模型构建
项目管理：项目规划，进度管理，风险管理，团队协作，项目评估
综合分析能力：综合素材分析，综合判断，综合决策，综合评估，问题诊断
专业技能：
大数据分析：数据清洗，数据处理，数据挖掘技术，数据模型构建，数据可视化
风险评估与控制：风险识别，风险评估方法，风险控制策略，内部控制审计，风险报告
数据隐私与合规审计：数据保护策略审计，隐私合规性审计，数据使用合规性审计，数据安全审计，数据隐私合规框架
内部控制审计：流程分析，风险评估，控制评估，审计程序，内部控制报告
数据可视化与报告撰写：数据可视化工具，报表设计，信息呈现，报告撰写，审计发现汇报
以上是针对大数据与审计的专业素养、通用能力和专业技能的分析，希望能对您的文本分析任务有所帮助。"
统计与大数据分析,"作为物流行业的职业分析师，我将为您提供关于统计与大数据分析的专业素养、通用能力和专业技能的分析。下面是按照您的要求提取的三个维度的能力列表：
专业素养能力：
统计学基础：概率统计，假设检验，回归分析，抽样理论，统计推断
数据分析方法：数据清洗，数据预处理，数据可视化，统计分析，机器学习
数据探索：数据描述统计，相关分析，聚类分析，因子分析，时间序列分析
数据模型构建：回归模型，决策树，支持向量机，神经网络，深度学习
商业智能：数据分析，数据挖掘，决策支持，市场调研，竞争分析
通用能力：
问题解决能力：逻辑思维，创新思维，解决方案提供，决策能力，问题排查
沟通能力：口头表达，书面沟通，跨部门协作，客户关系管理，演示技巧
数据分析能力：数据处理，数据解读，数据可视化，统计分析，数据模型构建
项目管理：项目规划，进度管理，风险管理，团队协作，项目评估
综合分析能力：综合素材分析，综合判断，综合决策，综合评估，问题诊断
专业技能：
数据清洗与预处理：数据清洗，异常值处理，缺失值处理，数据转换，特征选择
统计分析方法：假设检验，方差分析，回归分析，因子分析，聚类分析
大数据处理：分布式计算，数据存储技术，大数据处理框架，并行计算，数据流处理
机器学习算法：决策树，支持向量机，朴素贝叶斯，随机森林，深度学习
数据可视化：图表设计，数据呈现，交互式可视化，仪表盘设计，报告撰写
以上是针对统计与大数据分析的专业素养、通用能力和专业技能的分析，希望能对您的文本分析任务有所帮助。"
统计与会计核算,"作为物流行业的职业分析师，我将为您提供关于统计与会计核算的专业素养、通用能力和专业技能的分析。下面是按照您的要求提取的三个维度的能力列表：
专业素养能力：
会计基础知识：财务会计，成本会计，管理会计，财务报表，会计准则
统计学基础：概率统计，假设检验，回归分析，抽样理论，统计推断
会计法规与合规：会计法律法规，财务报告准则，会计核算规范，内部控制，审计准则
财务分析：财务比率分析，财务预测，财务评估，财务指标分析，财务报告解读
商业智能：数据分析，数据挖掘，决策支持，市场调研，竞争分析
通用能力：
问题解决能力：逻辑思维，创新思维，解决方案提供，决策能力，问题排查
沟通能力：口头表达，书面沟通，跨部门协作，客户关系管理，演示技巧
数据分析能力：数据处理，数据解读，数据可视化，统计分析，数据模型构建
项目管理：项目规划，进度管理，风险管理，团队协作，项目评估
综合分析能力：综合素材分析，综合判断，综合决策，综合评估，问题诊断
专业技能：
财务会计核算：账务处理，财务报表编制，会计准则应用，成本核算，资产负债管理
统计分析方法：假设检验，方差分析，回归分析，时间序列分析，因子分析
财务报表分析：财务比率分析，财务指标解读，趋势分析，竞争对手分析，财务预测
内部控制与审计：内部控制评估，风险管理，审计程序，审计准则，内部审计
会计软件应用：财务软件操作，电子表格技能，数据库管理，数据导入导出，报表生成
以上是针对统计与会计核算的专业素养、通用能力和专业技能的分析，希望能对您的文本分析任务有所帮助。"
市场调查与统计分析,"作为物流行业的职业分析师，我将为您提供关于市场调查与统计分析的专业素养、通用能力和专业技能的分析。下面是按照您的要求提取的三个维度的能力列表：
专业素养能力：
市场调查方法：问卷设计，访谈技巧，数据收集，调研分析，市场定位
统计学基础：概率统计，假设检验，回归分析，抽样理论，统计推断
市场分析理论：市场规模估算，市场趋势分析，竞争对手分析，市场细分，市场需求预测
数据分析工具：数据清洗，数据可视化，统计分析软件，数据模型构建，数据解读
商业智能：数据分析，数据挖掘，决策支持，市场调研，竞争分析
通用能力：
问题解决能力：逻辑思维，创新思维，解决方案提供，决策能力，问题排查
沟通能力：口头表达，书面沟通，跨部门协作，客户关系管理，演示技巧
数据分析能力：数据处理，数据解读，数据可视化，统计分析，数据模型构建
项目管理：项目规划，进度管理，风险管理，团队协作，项目评估
综合分析能力：综合素材分析，综合判断，综合决策，综合评估，问题诊断
专业技能：
市场调查设计：样本选择，问卷设计，访谈技巧，数据收集方法，市场调研计划
数据清洗与处理：数据清洗，数据转换，异常值处理，缺失值处理，数据整合
统计分析方法：假设检验，方差分析，回归分析，聚类分析，时间序列分析
市场趋势分析：市场规模估算，市场份额分析，市场增长率计算，趋势预测，竞争分析
数据可视化与报告撰写：图表设计，数据呈现，报表撰写，数据解读，报告演示技巧
以上是针对市场调查与统计分析的专业素养、通用能力和专业技能的分析，希望能对您的文本分析任务有所帮助。"
服务外包,"作为物流行业的职业分析师，我将为您提供关于服务外包的专业素养、通用能力和专业技能的分析。下面是按照您的要求提取的三个维度的能力列表：
专业素养能力：
服务外包市场：市场趋势分析，竞争对手分析，市场定位，市场需求预测，行业洞察
服务外包模型：业务流程外包，业务功能外包，IT外包，人力资源外包，知识过程外包
合作伙伴管理：合作伙伴招募，合作伙伴关系管理，合作伙伴绩效评估，合作伙伴协作，合作伙伴沟通
契约管理：契约设计，契约履行，契约管理工具，契约风险评估，契约谈判
商业智能：数据分析，数据挖掘，决策支持，市场调研，竞争分析
通用能力：
问题解决能力：逻辑思维，创新思维，解决方案提供，决策能力，问题排查
沟通能力：口头表达，书面沟通，跨部门协作，客户关系管理，演示技巧
数据分析能力：数据处理，数据解读，数据可视化，统计分析，数据模型构建
项目管理：项目规划，进度管理，风险管理，团队协作，项目评估
综合分析能力：综合素材分析，综合判断，综合决策，综合评估，问题诊断
专业技能：
服务外包策划：外包项目规划，外包流程设计，外包服务评估，外包合同管理，外包交付管理
供应商选择与管理：供应商评估，供应商谈判，供应商绩效管理，供应商风险评估，供应商合作
合规与风险管理：法律合规性，合同风险管理，数据隐私保护，知识产权保护，信息安全管理
服务质量管理：服务级别协议，关键绩效指标，客户满意度调查，问题解决和改进，服务质量评估
跨文化管理：跨文化沟通，文化敏感度，团队多样性管理，全球业务协作，国际法规了解
以上是针对服务外包的专业素养、通用能力和专业技能的分析，希望能对您的文本分析任务有所帮助。"
