name,answer
商务管理,"作为物流行业的职业分析师，我将为您提供关于商务管理的专业素养、通用能力和专业技能的分析。下面是按照您的要求提取的三个维度的能力列表：
专业素养能力：
商务战略规划：市场分析，竞争分析，商业模式设计，战略定位，市场营销策略
商务法律与合规：商务合同管理，法律合规性，商业保险，知识产权保护，风险管理
商务伦理与社会责任：商业道德，社会责任倡议，企业公民意识，可持续发展，企业形象管理
跨文化沟通与管理：跨文化沟通技巧，文化敏感度，国际业务协调，全球团队管理，多元文化融合
商业智能：市场调研，数据分析，决策支持，竞争分析，商业模型开发
通用能力：
问题解决能力：逻辑思维，创新思维，解决方案提供，决策能力，问题排查
沟通能力：口头表达，书面沟通，跨部门协作，客户关系管理，演示技巧
领导力：团队管理，目标设定，决策能力，激励团队，冲突管理
项目管理：项目规划，进度管理，资源管理，风险管理，团队协作
综合分析能力：综合素材分析，综合判断，综合决策，综合评估，问题诊断
专业技能：
市场营销策划：市场定位，产品定价，促销策略，渠道管理，品牌建设
谈判与协商：谈判策略，谈判技巧，协商能力，合同谈判，冲突解决
供应链管理：供应商管理，物流管理，库存管理，需求计划，运输优化
业务拓展与合作：业务发展策略，市场拓展，合作伙伴关系管理，业务合作谈判，客户关系管理
商务报告与分析：数据分析，商务报告撰写，财务分析，市场趋势分析，竞争对手分析
以上是针对商务管理的专业素养、通用能力和专业技能的分析，希望能对您的文本分析任务有所帮助。"
跨境电子商务,"作为物流行业的职业分析师，我将为您提供关于跨境电子商务的专业素养、通用能力和专业技能的分析。下面是按照您的要求提取的三个维度的能力列表：
专业素养能力：
跨境电商市场：市场趋势分析，竞争对手分析，市场定位，市场需求预测，全球商业环境
国际贸易法规：关税规定，进出口合规，海关手续，贸易协议，知识产权保护
跨文化管理：跨文化沟通技巧，文化敏感度，国际业务协调，全球团队管理，多元文化融合
供应链管理：国际采购，物流管理，仓储与配送，退货与售后，海外仓管理
商业智能：数据分析，数据挖掘，决策支持，市场调研，竞争分析
通用能力：
问题解决能力：逻辑思维，创新思维，解决方案提供，决策能力，问题排查
沟通能力：口头表达，书面沟通，跨部门协作，客户关系管理，演示技巧
领导力：团队管理，目标设定，决策能力，激励团队，冲突管理
项目管理：项目规划，进度管理，资源管理，风险管理，团队协作
综合分析能力：综合素材分析，综合判断，综合决策，综合评估，问题诊断
专业技能：
跨境电商策划：市场定位，产品选择，跨境品牌建设，国际营销策略，全球电商平台运营
海外市场开拓：市场调研，供应链管理，海外销售渠道，市场推广，品牌推广
跨境支付与结算：支付体系了解，支付合规，外汇管理，结算方式选择，风险防控
跨境物流与仓储：海关规定，国际物流运输，海外仓管理，报关流程，退货与售后处理
跨境电商数据分析：数据收集，数据清洗，数据可视化，市场趋势分析，竞争对手分析
以上是针对跨境电子商务的专业素养、通用能力和专业技能的分析，希望能对您的文本分析任务有所帮助。"
农村电子商务,"作为物流行业的职业分析师，我将为您提供关于农村电子商务的专业素养、通用能力和专业技能的分析。下面是按照您的要求提取的三个维度的能力列表：
专业素养能力：
农村电商市场：农产品市场分析，农村消费者行为，市场定位，市场需求预测，农村电商政策
农村产业发展：农村产业分析，农村产业链管理，农产品品牌建设，产业扶贫，农村经济发展
农村消费者洞察：农村消费者调研，消费者行为分析，农村消费习惯，购物特点，消费心理
农村物流与配送：农产品采购与供应链管理，物流配送网络搭建，冷链物流管理，配送优化，仓储管理
商业智能：数据分析，数据挖掘，决策支持，市场调研，竞争分析
通用能力：
问题解决能力：逻辑思维，创新思维，解决方案提供，决策能力，问题排查
沟通能力：口头表达，书面沟通，跨部门协作，客户关系管理，演示技巧
领导力：团队管理，目标设定，决策能力，激励团队，冲突管理
项目管理：项目规划，进度管理，资源管理，风险管理，团队协作
综合分析能力：综合素材分析，综合判断，综合决策，综合评估，问题诊断
专业技能：
农产品选品与营销：产品评估，市场定位，渠道选择，农产品包装设计，促销策略
农村电商平台运营：平台搭建与管理，产品上架与库存管理，订单处理与售后服务，数据分析与运营优化，用户体验改进
农村物流解决方案：物流网络规划，运输合作伙伴管理，运输成本控制，冷链物流管理，仓储与配送管理
农村电商政策与法规：政策解读，合规管理，政府扶持政策了解，知识产权保护，风险防控
农村电商数据分析：数据收集与清洗，数据可视化，市场趋势分析，用户行为分析，竞争对手分析
以上是针对农村电子商务的专业素养、通用能力和专业技能的分析，希望能对您的文本分析任务有所帮助。"
航空物流管理,"作为物流行业的职业分析师，我将为您提供关于航空物流管理的专业素养、通用能力和专业技能的分析。下面是按照您的要求提取的三个维度的能力列表：
专业素养能力：
航空物流市场：市场趋势分析，航空货运市场，竞争对手分析，市场需求预测，航空物流政策
航空运输规划与管理：航班计划，航线选择，航空运输资源管理，航空货物装载计划，航空运输成本控制
航空安全与风险管理：飞行安全规定，货物安全管理，航空保险，危险品管理，突发事件应急处理
航空运价与合同管理：运价制定，合同谈判与管理，航空运输合同条款，费用结算，索赔处理
商业智能：数据分析，数据挖掘，决策支持，市场调研，竞争分析
通用能力：
问题解决能力：逻辑思维，创新思维，解决方案提供，决策能力，问题排查
沟通能力：口头表达，书面沟通，跨部门协作，客户关系管理，演示技巧
领导力：团队管理，目标设定，决策能力，激励团队，冲突管理
项目管理：项目规划，进度管理，资源管理，风险管理，团队协作
综合分析能力：综合素材分析，综合判断，综合决策，综合评估，问题诊断
专业技能：
航空货物管理：货物接收与装载，货物追踪与监控，货物分拣与仓储，货物损坏与遗失处理，特殊货物管理
航空仓库管理：仓库布局与设计，库存管理，出入库操作，货物配送与转运，仓库安全管理
运输计划与调度：航班计划制定，货物配载计划，运输资源调度，航班监控与调整，航班延误处理
航空物流技术应用：物流信息系统，航空追踪技术，航空运输优化，航空智能装备，无人机应用
航空运营优化：运输成本优化，航班运力管理，运输效率改进，航空合作伙伴关系管理，客户满意度提升
以上是针对航空物流管理的专业素养、通用能力和专业技能的分析，希望能对您的文本分析任务有所帮助。"
铁路物流管理,"作为物流行业的职业分析师，我将为您提供关于铁路物流管理的专业素养、通用能力和专业技能的分析。下面是按照您的要求提取的三个维度的能力列表：
专业素养能力：
铁路物流市场：市场趋势分析，铁路货运市场，竞争对手分析，市场需求预测，铁路物流政策
铁路运输规划与管理：列车调度，运输资源管理，运输成本控制，车辆装载规划，运输网络设计
铁路安全与风险管理：运行安全规定，货物安全管理，事故应急处理，安全培训与意识，风险评估与控制
运价与合同管理：运价制定，合同谈判与管理，费用结算，索赔处理，合同条款管理
商业智能：数据分析，数据挖掘，决策支持，市场调研，竞争分析
通用能力：
问题解决能力：逻辑思维，创新思维，解决方案提供，决策能力，问题排查
沟通能力：口头表达，书面沟通，跨部门协作，客户关系管理，演示技巧
领导力：团队管理，目标设定，决策能力，激励团队，冲突管理
项目管理：项目规划，进度管理，资源管理，风险管理，团队协作
综合分析能力：综合素材分析，综合判断，综合决策，综合评估，问题诊断
专业技能：
货物装载与运输：车辆装载规划，货物装载操作，货物装卸安全，货物追踪与监控，运输路线选择
铁路货场与仓储管理：货物分类与分拣，货场操作流程，货物堆放与保管，货场安全管理，货物配送与转运
运输计划与调度：列车调度计划制定，运输资源调度，车辆轮换与维护，运输成本优化，运输效率改进
铁路物流技术应用：物流信息系统，铁路追踪技术，铁路运输优化，车辆调度系统，智能装备应用
铁路运营优化：运输成本优化，运输效率改进，运输网络优化，合作伙伴管理，客户满意度提升
以上是针对铁路物流管理的专业素养、通用能力和专业技能的分析，希望能对您的文本分析任务有所帮助。"
港口物流管理,"作为物流行业的职业分析师，我将为您提供关于港口物流管理的专业素养、通用能力和专业技能的分析。下面是按照您的要求提取的三个维度的能力列表：
专业素养能力：
港口物流市场：市场趋势分析，港口货运市场，竞争对手分析，市场需求预测，港口物流政策
港口运输规划与管理：船舶调度，港口资源管理，运输成本控制，装卸计划制定，港口运输网络设计
港口安全与风险管理：港口安全规定，货物安全管理，事故应急处理，安全培训与意识，风险评估与控制
港口运价与合同管理：运价制定，合同谈判与管理，费用结算，索赔处理，合同条款管理
商业智能：数据分析，数据挖掘，决策支持，市场调研，竞争分析
通用能力：
问题解决能力：逻辑思维，创新思维，解决方案提供，决策能力，问题排查
沟通能力：口头表达，书面沟通，跨部门协作，客户关系管理，演示技巧
领导力：团队管理，目标设定，决策能力，激励团队，冲突管理
项目管理：项目规划，进度管理，资源管理，风险管理，团队协作
综合分析能力：综合素材分析，综合判断，综合决策，综合评估，问题诊断
专业技能：
船舶调度与管理：船舶计划制定，船舶调度操作，船舶货物装卸，港口资源调度，船舶运输成本控制
港口货物仓储管理：货物分类与分拣，货物装卸操作，货物堆放与保管，仓库安全管理，货物配送与转运
运输计划与调度：货物装卸计划制定，运输资源调度，运输成本优化，运输效率改进，运输网络设计
港口物流技术应用：物流信息系统，港口货物追踪技术，港口运输优化，装卸设备应用，智能港口技术
港口运营优化：运输成本优化，运输效率改进，港口合作伙伴关系管理，客户满意度提升，港口业务拓展
以上是针对港口物流管理的专业素养、通用能力和专业技能的分析，希望能对您的文本分析任务有所帮助。"
工程物流管理,"作为物流行业的职业分析师，我将为您提供关于工程物流管理的专业素养、通用能力和专业技能的分析。下面是按照您的要求提取的三个维度的能力列表：
专业素养能力：
工程物流规划：项目规划与管理，物流流程设计，物流需求分析，工程物流资源管理，物流成本控制
工程物流风险管理：风险评估与控制，应急预案制定，安全管理，工程物流法规，危险品管理
工程物流市场分析：市场趋势分析，竞争对手分析，需求预测，物流服务定位，市场调研
物流技术应用：物流信息系统，自动化设备应用，物流追踪技术，数据分析，智能物流技术
环境可持续发展：绿色物流实践，节能减排，资源回收利用，环境监测与评估，可持续供应链管理
通用能力：
问题解决能力：逻辑思维，创新思维，解决方案提供，决策能力，问题排查
沟通能力：口头表达，书面沟通，跨部门协作，客户关系管理，演示技巧
领导力：团队管理，目标设定，决策能力，激励团队，冲突管理
项目管理：项目规划，进度管理，资源管理，风险管理，团队协作
综合分析能力：综合素材分析，综合判断，综合决策，综合评估，问题诊断
专业技能：
物流计划与调度：物流需求分析，物流资源调度，运输路线规划，装卸计划制定，物流调度指挥
供应链管理：供应商管理，采购与供应管理，库存控制，订单处理，供应链协调与优化
货物包装与标识：包装设计与选择，标识要求与制定，货物捆绑与封装，包装材料选择，防护措施
工程物流设备操作：叉车操作，起重机操作，搬运设备操作，仓储设备操作，运输工具操作
物流成本管理：成本估算与控制，运输成本分析，库存成本管理，仓储成本优化，物流成本效益评估
以上是针对工程物流管理的专业素养、通用能力和专业技能的分析，希望能对您的文本分析任务有所帮助。"
采购与供应管理,"作为物流行业的职业分析师，我将为您提供关于采购与供应管理的专业素养、通用能力和专业技能的分析。下面是按照您的要求提取的三个维度的能力列表：
专业素养能力：
采购战略规划：供应链战略，采购策略，供应商选择，供应商管理，采购风险评估
供应链风险管理：供应风险评估，应急预案制定，供应链安全管理，供应链法规合规，业务连续性管理
供应市场分析：市场趋势分析，竞争对手分析，供应商调查，需求预测，市场调研
供应商关系管理：供应商评估，供应商合作协议，供应商绩效评估，供应商开发，供应商沟通与协调
商务智能：数据分析，数据挖掘，决策支持，市场调研，竞争分析
通用能力：
问题解决能力：逻辑思维，创新思维，解决方案提供，决策能力，问题排查
沟通能力：口头表达，书面沟通，跨部门协作，客户关系管理，演示技巧
领导力：团队管理，目标设定，决策能力，激励团队，冲突管理
项目管理：项目规划，进度管理，资源管理，风险管理，团队协作
综合分析能力：综合素材分析，综合判断，综合决策，综合评估，问题诊断
专业技能：
供应商评估与选择：供应商背景调查，供应商评估指标制定，供应商排名，供应商谈判，供应商合同管理
采购流程管理：采购需求分析，采购计划制定，询价与比价，采购合同管理，供应商支付与结算
供应链协调与优化：库存管理，订单处理，供应链协调，交货期管理，供应链性能评估
采购风险管理：风险评估与控制，供应商风险管理，市场风险管理，物流风险管理，法律合规风险管理
采购谈判与合同管理：谈判策略与技巧，合同起草与审查，合同谈判，供应商合同管理，索赔与争议解决
以上是针对采购与供应管理的专业素养、通用能力和专业技能的分析，希望能对您的文本分析任务有所帮助。"
